{
  "version": "1.0",
  "artifact_type": "final_verdict",
  "artifact_id": "fv-task-003",
  "producer_type": "product_authority",
  "created_at": "2026-04-01T16:00:00Z",
  "task_id": "task-003",
  "verdict": "pass",
  "rationale": "Authentication flow meets all acceptance criteria. Open risks are non-blocking and tracked as debt. Critical reviewer concern about token storage is valid but non-blocking for MVP phase; tracked for follow-up.",
  "closure_packet_ref": "cp-task-003"
}
